<?xml version="1.0" encoding="UTF-8"?>
<!DOCTYPE TestCase SYSTEM "testcase.dtd">
<?xml-stylesheet href="testcase2html.xsl" type="text/xsl"?>
<TestCase TestCaseID="TC_2" PrevTestCaseID="TC_1" NextTestCaseID="TC_3" PrefixID="P_3">
 <SessionData>
  <FunName>Tritype</FunName>
  <Strategy Coverage="all-branches" IterLimit="none" RecurLimit="none" SuffixLengthLimit="none" />
  <When>Tue Jun 27 15:07:51 2023</When>
  <Version>4.0. Build Tue May  9 15:05:46 2023</Version>
  <TestReportFile>testreport.xml</TestReportFile>
  <TestSessionFile>testsession.xml</TestSessionFile>
 </SessionData>
 <Time>Tue Jun 27 15:07:52 2023</Time>
 <Dur>1</Dur>
 <Inputs>
  <VVal>
   <VName>i</VName>
   <Val>0</Val>
  </VVal>
  <VVal>
   <VName>j</VName>
   <Val>-1.7976931348623157e+308</Val>
  </VVal>
  <VVal>
   <VName>k</VName>
   <Val>0</Val>
  </VVal>
 </Inputs>
 <Verdict Type="unknown" />
 <Prefix>
  <N BlocID="243" SrcFile="TriType.c">10a</N>
  <P BlocID="248">10b</P>
 </Prefix>
 <Suffix />
 <Outputs>
  <Output>
   <VName>return value</VName>
   <Val>3</Val>
  </Output>
 </Outputs>
 <SymOutputs>
  <SymOutput>
   <VName>return value</VName>
   <Val>3</Val>
  </SymOutput>
 </SymOutputs>
 <PathPredicate>
  <Ctr>i&gt;=0</Ctr>
  <Ctr>j&lt;0</Ctr>
 </PathPredicate>
</TestCase>