<?xml version="1.0" encoding="UTF-8"?>
<!DOCTYPE TestCase SYSTEM "testcase.dtd">
<?xml-stylesheet href="testcase2html.xsl" type="text/xsl"?>
<TestCase TestCaseID="TC_1" NextTestCaseID="TC_2" PrefixID="P_4">
 <SessionData>
  <FunName>testme</FunName>
  <Strategy Coverage="all-branches" IterLimit="none" RecurLimit="none" SuffixLengthLimit="none" />
  <When>Mon Nov 20 16:07:18 2023</When>
  <Version>4.0. Build Tue May  9 15:05:46 2023</Version>
  <TestReportFile>testreport.xml</TestReportFile>
  <TestSessionFile>testsession.xml</TestSessionFile>
 </SessionData>
 <Time>Mon Nov 20 16:07:18 2023</Time>
 <Dur>0</Dur>
 <Inputs>
  <ArDim>
   <VName>argv</VName>
   <Val>0</Val>
  </ArDim>
  <VVal>
   <VName>argc</VName>
   <Val>1814420628</Val>
  </VVal>
 </Inputs>
 <Verdict Type="interrupt">The tested function was interrupted (signal 11 (SIGSEGV - Invalid memory reference)) after executing the positive branch of the 2nd condition at line number 62 of file /work/pathcrawler/troubleshoot.c.
[pc] Please check your test context.
</Verdict>
 <Prefix>
  <P BlocID="980" SrcFile="/work/pathcrawler/troubleshoot.c">61</P>
  <N BlocID="984">62a</N>
  <P BlocID="987">62b</P>
 </Prefix>
 <Suffix />
 <Outputs>
 </Outputs>
 <SymOutputs>
 </SymOutputs>
 <PathPredicate>
 </PathPredicate>
</TestCase>