<?xml version="1.0" encoding="UTF-8"?>
<!DOCTYPE TestCase SYSTEM "testcase.dtd">
<?xml-stylesheet href="testcase2html.xsl" type="text/xsl"?>
<TestCase TestCaseID="TC_7" PrevTestCaseID="TC_6" NextTestCaseID="TC_8" PrefixID="P_6">
 <SessionData>
  <FunName>Tritype</FunName>
  <Strategy Coverage="all-branches" IterLimit="none" RecurLimit="none" SuffixLengthLimit="none" />
  <When>Tue Jun 27 15:07:51 2023</When>
  <Version>4.0. Build Tue May  9 15:05:46 2023</Version>
  <TestReportFile>testreport.xml</TestReportFile>
  <TestSessionFile>testsession.xml</TestSessionFile>
 </SessionData>
 <Time>Tue Jun 27 15:07:52 2023</Time>
 <Dur>1</Dur>
 <Inputs>
  <VVal>
   <VName>i</VName>
   <Val>-0</Val>
  </VVal>
  <VVal>
   <VName>j</VName>
   <Val>4.9406564584124654e-324</Val>
  </VVal>
  <VVal>
   <VName>k</VName>
   <Val>-0</Val>
  </VVal>
 </Inputs>
 <Verdict Type="unknown" />
 <Prefix>
  <N BlocID="243" SrcFile="TriType.c">10a</N>
  <N BlocID="248">10b</N>
  <N BlocID="251">10c</N>
  <N BlocID="257">12a</N>
  <N BlocID="262">12b</N>
 </Prefix>
 <Suffix>
  <P BlocID="265" SrcFile="TriType.c">12c</P>
 </Suffix>
 <Outputs>
  <Output>
   <VName>return value</VName>
   <Val>3</Val>
  </Output>
 </Outputs>
 <SymOutputs>
  <SymOutput>
   <VName>return value</VName>
   <Val>3</Val>
  </SymOutput>
 </SymOutputs>
 <PathPredicate>
  <Ctr>i&gt;=0</Ctr>
  <Ctr>j&gt;=0</Ctr>
  <Ctr>k&gt;=0</Ctr>
  <Ctr>(i+j)&gt;k</Ctr>
  <Ctr>(j+k)&gt;i</Ctr>
  <Ctr>(k+i)=&lt;j</Ctr>
 </PathPredicate>
</TestCase>